emotion,source_name,source_type,text
DISGUST,overhear,vk,"Недавно муж перешёл на вегетарианское питание в связи с состоянием здоровья. Теперь ночью пукает так, что глаза слезятся и дыхание перехватывает, хотя раньше такого не наблюдалось. Очень люблю его, но сказать ему не могу, так как это его расстроит. Но глаза мои, глаза. Про нос молчу.   "
DISGUST,overhear,vk,"Работаю учителем в школе. Начался сезон простуд, и меня, видимо, тоже стороной не обошло. Стою у доски, записываю число и вдруг чихаю. Из носа сопли вылетают до нижней губы, под рукой ни платка, ничего. Пришлось слизать…   "
DISGUST,overhear,vk,"Обожаю чихать. Чтобы делать это чаще, я щекочу нос прядкой волос. Делаю это снова и снова, пока волосы не станут мокрыми от слизи. Облизываю и продолжаю щекотаться. Кайф))   "
DISGUST,overhear,vk,"В детстве бабушка периодически кормила нас с сестрой супом, в котором плавали какие-то жучки. Видимо, жившие в крупе, из которой был сварен суп. Когда бабушке говорили о жучках, она злилась, потому что сослепу не видела их в тарелке и говорила, чтоб мы ели и не перебирали харчами. Приходилось есть.   "
DISGUST,overhear,vk,"Для меня невероятное удовольствие — есть собственную рвоту. Обожаю после еды спазмами желудка выдавить все обратно и снова ощутить этот чудесный вкус завтрака, обеда или ужина. Многие спрашивают меня, почему я постоянно что-то жую, просят жвачку... У меня нет жвачки, зато есть рвота!   "
DISGUST,overhear,vk,"Моя бывшая свекровь — человек образованный, лет с десяти жила в квартире, но после всех туалетных дел она пользуется тряпочкой. Идёт в ванну, свешивает туда свою сраную жопу, мылит тряпочку в раковине, елозил немытой промежностью по краю ванны, мыльная грязная жижа течёт в ванну. За собой она ванну не споласкивает, ведь она ей не пользовалась, и плевать, что дети подходят мыть руки как раз к этому же месту, где она елозила сраной мыльной задницей. ""Да все болезни и грязь от туалетной бумаги"".   "
DISGUST,overhear,vk,"Работаю на разъездной работе. Часто за рулём. Есть напарник, который всегда сидит на пассажирском. Неимоверно бесит, что во время езды вечно теребит свои причиндалы, думая, что я не вижу. А я все вижу краем глаза. И сделать замечание как-то стремно. Ещё любит сморкаться, вытирая сопли, растирая между рук, на которых ногти больше, чем мои с маникюром. Со стороны та ещё картина. Всегда предлагаю салфетки и протираю место, где он сидел.   "
DISGUST,overhear,vk,"В студенческие времена работала хостес в ресторане. Подаю я очередным гостям меню, желаю приятного вечера и краем глаза замечаю новенькую официантку, которая несёт с кухни буйабес — суп французский — и вдруг как чихнёт, да так метко, что прям в тарелку. И пришлось ведь подать — суп безумно дорогой, шеф ей по башке бы настучал. Так что я её понимаю. Гости, конечно, ничего не заметили, ели и нахваливали.   "
DISGUST,overhear,vk,"У меня в подчинении работает бабулька, 70 лет, умная, ответственная, исполнительна, два раза в неделю уходит в университет читать лекции. Но, ёбен бобен! Берёт и стрижёт свои красные ногти на работе, при этом они у неё по причине того, что твёрдые, разлетаются во все стороны!   "
DISGUST,overhear,vk,"Мои глаза! Нет, не так — МОИ ГЛАЗА этого не видели! Пришла на днях к подруге, а она готовит кушать. Пока я попивала чаёк, она что-то чистит, режет, руки, в общем, заняты. И тут она резко останавливает этот процесс, поворачивается к выходу из кухни и зовёт мужа. Тот приходит, а она ему: ""Почеши пизду, а то руки лень мыть"", — и он при мне лезет ей в штаны и усердно там наяривает. После нюхает руку и говорит: ""Фуу... упрела вся, помойся потом"". Я не ханжа, но это перебор.   "
DISGUST,overhear,vk,"Последние несколько лет постоянно ем лобковые волосы. Самое любимое — грызть их, но в последнее время все чаще задумываюсь, какой комок волос может быть у меня в желудке. Но грызть продолжаю. Грызу и плачу. Грызу и плачу.   "
DISGUST,overhear,vk,"В каком-то сериале слышала, что моча младенца омолаживает кожу. Решила попробовать: протирала лицо как тоником, и через неделю моего эксперимента мелкие морщинки разгладились, поры стали чище, кожа стала бархатистой. К сожалению, такой находкой с подружками не поделишься.   "
DISGUST,overhear,vk,"Не ем пищу, приготовленную чужими руками. Не могу даже представить, сразу рвотные позывы. И это после того, как шесть лет назад в ресторане принесли блюдо, приправленное кусочком крысиного хвоста.   "
DISGUST,overhear,vk,"Отмечали какой-то праздник. Компания мужская, только хозяин квартиры с девушкой. От обилия газированных напитков потянуло на отрыжку. При девушке неудобно. И терпел долго, потом выходил. И в какой-то момент она вдруг как рыгнёт! На мой офигевший взгляд и вопрос ""нафига я столько терпел"", сказала: ""Не, ну, чего ты? Не стесняйся, все же свои!"" Ответил ей протяжным рыком.   "
DISGUST,overhear,vk,"Я просто обожаю давить прыщи. Самое кайфовое чувство, когда ты его придавливаешь, он лопается и забрызгивает зеркало... Каайф! А самое большое мучение, когда прыщ вылезает где-нибудь на спине, и я не могу к нему дотянуться. Вот видишь его, чувствуешь его, он весь такой белый и зрелый, а испытать кайф не можешь.   "
DISGUST,overhear,vk,"Раньше мне казалось, что ""уссаться от смеха"" — метафора. Но вот читала однажды истории в интернете и в какой-то момент поняла, что вот сейчас описаюсь... До туалета не добежала, стояла и ссала на пол и от этого ухохатывалась ещё больше.   "
DISGUST,overhear,vk,"Делаю планку по утрам. Сегодня что-то пошло не так, и я выблевала содержимое желудка (не знаю, что там могло быть). Проглотила, не меняя положения. Не мыть же ещё и полы по утрам.   "
DISGUST,overhear,vk,"Когда собираемся с друзьями погудеть у кого-то на квартире, устраиваем конкурс — кто громче и тухлее пёрнет. Победителю достается бутылка пива и пачка чипсов. Взрослые люди обоих полов. Всем 30 лет.   "
DISGUST,overhear,vk,"Когда была у парня, захотелось в туалет по-большому. Сделав грязные дела, обнаружила, что экскременты не смываются, а воды больше нет. Кое-как удалось смыть улики, а вот коричневый след от них — нет. Взяла ёршик, вытерла, но следы остались на нём. Туалетная бумага не помогла. Нашла в туалете половую тряпку, вытерла ей. Ёршик чист, тряпка — в говне и воняет соответственно. Оставлять нельзя. Скомкала её и спрятала в свой рюкзак. Носила весь день в пакетике (благо был) до вечера, пока не выкинула.   "
DISGUST,overhear,vk,"У моего мужа есть одна ебанутая привычка: каждый раз, когда его руки оказываются без дела, он так и норовит засунуть мне их в зад и понюхать. И похуй, что я только из WC после больших дел. Бесит!   "
DISGUST,overhear,vk,"Я обожаю запах тухлятинки из кошачьей пасти. Подходишь к коту, когда он спит, начинаешь целовать морду, ""мяукалку"", кот открывает припухшие узкие сонные глаза, начинает облизывать нос и причмокивать... Моська, помятая ото сна, и чудный запах сонной пасти! Не скажу, что он приятный, но мне становится так уютно, и радость переполняет))   "
DISGUST,overhear,vk,"Раннее утро, я сонная как сурок, собираюсь на работу. Вспоминаю, что надо покормить змей. Закинула размораживаться мышей в тёплую воду, но не в миску, как обычно, а в чашку — всё второпях, как всегда. Естественно, я забыла об этом, пока собиралась. И, естественно, перепутала злополучных мышей с чашкой чая и отхлебнула...   "
DISGUST,overhear,vk,"Моя бабушка советской закалки, не признавала никогда прокладки. Как-то она прокладку не той стороной прилепила и больше ими не пользовалась. Вместо этого складывала в трусы вату. А после выбрасывала. А ещё моя бабушка очень ленивая, чтобы дойти до мусорки. Она жила в отдельной комнате, и при переезде под ее кроватью обнаружилась большая гора этих самых ваток.   "
DISGUST,overhear,vk,"В детстве могла подолгу ходить в одном и том же нижнем белье. Уговоры мамы сменить его не действовали. Тогда она сказала, что если я попаду под машину, то в больнице увидят моё бельё и будут надо мной смеяться. Сейчас мне 28. Трусы менять чаще я не стала, но дорогу перехожу строго по пешеходному переходу.   "
DISGUST,overhear,vk,"Как-то сестра отдала на время отпуска своего кота, такого вислоухого кота с глазками-блюдцами и безграничным желанием вставать на задние лапки. Ложусь я, значит, спать, поворачиваюсь на край кровати, и тут черт дернул меня открыть глаза! Перед моим взором, на расстоянии см 10, медленно поднимаются два больших глаза, которые смотрят прямо в душу. Я блевал от страха на кота.   "
DISGUST,overhear,vk,"Сижу в одном кабинете с подчиненными, из них трое мужчин. С наступлением в Москве мерзкой погоды, каши под ботинками, у нас в помещении начало жутко вонять ногами. Сегодня выяснилась причина — один из этих героев сушил свои мокрые носки на системном блоке! Когда спросили ""какого черта"", сказал: ""А где ещё?""   "
DISGUST,overhear,vk,"Отправили меня в шесть лет в пионерский лагерь. Туалет был далеко от корпуса, и я боялась туда ночью ходить. И, как назло, по-большому хотелось именно ночью. Я придумала выковыривать какашки и втирать их в панцирную сетку под своим матрасом. Как ни странно — никто даже ничего не заметил.   "
DISGUST,overhear,vk,"На работе куча представительниц женского пола, но и мужики тоже есть. Как не стыдно и мерзко на весь офис орать, что ты с хвостиком, потому что лень было голову помыть? Еще б про трусы свои грязные орали! Апогей случился, когда одна сидит с засаленными волосами и просит сделать прическу, потому что ее бесит, что голова грязная, и чтоб не так было видно. В этот момент аж рвотные рефлексы начинаются.   "
DISGUST,overhear,vk,"Рассказал знакомый фельдшер: привезли они как-то бомжа с обморожением ног. А тот в отделении шапку снимать отказывается. Врач настоял, мол, некрасиво в шапке джентльмену сидеть. Тот снимает, а у него из кожи головы опарыши мелкие растут, шевелятся. Сам бомж лысый, видимо, черви все его волосы и пожрали. Выковыривали ему потом тех опарышей всем отделением.   "
DISGUST,overhear,vk,"Я понимаю, ситуации всякие бывают, но чтоб менять прокладку (не ежедневку) на кухне (на работе), когда я обедаю, и положить использованную прокладку на стол... ""Ой, приятного аппетита! Я не заметила тебя!"" Я девушка довольно высокая, не заметить трудновато. Ну, китайский городовой! Я хотела сесть на диету, но не таким же образом... :(   "
DISGUST,overhear,vk,"Вот кто-то любит давить прыщи, а я безумно люблю сдирать болячки на голове. Сама не знаю, почему они там образовываются, такие небольшие корочки, но я с таким наслаждением их сковыриваю, просто почти оргазм. Даже жалко, что редко их нахожу.   "
DISGUST,overhear,vk,"Сидит один мой кот на подоконнике и, видимо, переел, так как начались рвотные позывы. Так и оказалось: всё, что съел с такой жадностью, всё фонтаном хлынуло вниз... На второго кота... Этот ломанулся и поскользнулся на блевотине, попутно разбросав всё по комнате. Смеялась и плакала.   "
DISGUST,overhear,vk,Вчера после похода в принцессочную по великим делам я увидела свои вагинальные шарики вместе с царской горкой в унитазе... Успех — мое все!   
DISGUST,overhear,vk,"В детстве лежала в больнице, уже не помню, чем болела. Со мной в палате лежала девочка примерно моего возраста. Она все время жевала свои длинные темные волосы. Однажды вечером ее затошнило, и она, лежа на кровати, издавала звуки, будто рыгает, а потом вытащила из себя огромный мокрый клок волос. Бросила его на пол и уснула. На следующий день ее увезли на операцию, и больше я ее не видела. Но этот жуткий клок волос изо рта не забуду никогда...   "
DISGUST,overhear,vk,"Во времена бурной молодости много пила и кутила. Как-то во время очередной пьянки знакомый парень оказывал мне знаки внимания, я была не против. Уединились. ""Ты у меня первая"". Ничего страшного, подумала я. Делаю минет, он вроде кончает. Странно, консистенция не та, вкус не тот... Короче, этот ебантяй решил, что кончает, и нассал мне в рот. Я на него блеванула. Больше мы не общались, а подруга до сих пор вспоминает эту историю под кодовым названием ""Яблочный сок"".   "
DISGUST,overhear,vk,"У бывшего была ужасная привычка, поэтому и стал бывшим. Как-то захожу в ванну, а там воняет, как будто насрали. Он сидит в ванной, душем себя поливает и говорит: ""Я просто напукал"". Я думаю: ""Нихуя себе напукал"". Через неделю опаздывала на работу, залетаю в ванну, он опять там, и вонь... жуткая. Смотрю в ванну, а он сидит в собственном дерьме. Благо телефон был под рукой, сфоткала эту картину, сказала, что разошлю его друзьям, если не закажет мне новую ванну и ее установку. Ебаный засранец!   "
DISGUST,overhear,vk,"Пару лет назад мой бывший решил познакомить меня со своими друзьями. На вечеринке было много алкоголя, и он слегка перебрал, а закусывал он всё это своими любимыми маленькими острыми колбасками. В ванной ему стало плохо, так как санузел раздельный, варианта не было, как блевануть в раковину. Раковина засорилась. Он не в адеквате, в дверь стучат. Чтобы не сгореть от стыда, пришлось засунуть руку в эту жижу и использовать ладонь как вантуз.   "
DISGUST,overhear,vk,"Каждый вечер я проделываю этот ритуал: чищу зубы и затем давлю на гланды. Обожаю наблюдать, как из них выходят белые горошки. А потом я растираю один самый красивый горошек между ногтями и вдыхаю в себя этот адовый запах. Зато это мое.   "
DISGUST,overhear,vk,"У меня была очень странная знакомая. Часто заходила ко мне в гости. Когда она ходила в туалет, она никогда не смывала за собой (по-большому тоже). На вопрос, почему она так делает, отвечала: ""Ну, как-то неловко. Ты же услышишь, что унитаз смывает"". Ага... а то, что после ее визита меня в туалете ждут плавающие какахи — это ловко...   "
DISGUST,overhear,vk,"У моего парня ужасно воняет изо рта. Иногда кажется, что там кто-то сдох. Когда он засыпает, я приоткрываю его рот и вдыхаю этот запах. Один раз чуть не вырвало прямо на него. Но ничего не могу с собой поделать. Меня безумно заводит, когда этот смрад заполняет легкие.   "
DISGUST,overhear,vk,"Отмечали праздник. Пьяный дружище был сопровожден в туалет, так как ожидались фонтаны. Вот только что-то в его мозгу переключилось, и он стал воспринимать фаянсового друга за умывальник — стал мыть в унитазе руки по локоть. Пытаясь его успокоить, получили в ответ: ""Д-да все н-нормально, м-мне освежиться надо!"" — после чего он блеванул в унитаз, зачерпнул это все руками и умылся...   "
DISGUST,overhear,vk,"Это странно, может, даже противно, но я, как сказать, обожаю кровь во время месячных. На зуб. Я не понимаю, что за херня, но меня это пугает. Не могу остановиться, а когда понимаю, что делаю — охватывает чувство мерзости и блевоты. И так каждые месячные.   "
DISGUST,overhear,vk,"Работаю в одной кафешке. Как и у всех, у нас есть проблема с тараканами. Их самое любимое место — фрешница. Они откладывают свои яйца прям, где лопасти. Каждый раз, когда слышу звук морковки в фрешнице, представляю, как яйца перемалываются с морковкой. До дрожи. Фреши свежевыжатые больше не пью. Нигде.   "
