emotion,source_name,source_type,text
DISGUST,overhear,vk,"Мой бывший - свинья. Когда жили вместе, у него была отвратительная привычка: стриг бороду, а кучки волос складывал в углу ванной. Никакими уговорами не могла убедить убирать эту пакость за собой. Решила проучить его таким же оружием мерзости: в соседний уголок начала складывать свои использованные тампоны. Было противно, но 4 тампона лежали там 3 дня. Подхожу я к этому поросю и спрашиваю: ""Тебя не бесят тампоны в углу?"" И слышу в ответ: ""Какие тампоны?"" Война проиграна. Противник не заметил боевых действий   "
DISGUST,overhear,vk,"Как-то снимали с парнем комнату. В соседней жила девушка. На вид опрятная, приличная, адекватная, но какой же срач был в ее комнате. Про помойку под кроватью, горы грязной посуды, уличную обувь на кровати я молчу. Окончательно приняли решение о переезде, когда вытаскивали свою одежду из стиралки и поняли, что до нас она стирала тут же свое белье, с которого не сняла прокладки. Это дерьмо осталось в машинке и облепило нашу одежду. Она постирала прокладки! Не ежедневные. Одежду выкинули.   "
DISGUST,overhear,vk,"У меня есть одна история из детства, которой я стесняюсь. Мама накормила меня чем-то с изюмом, через какое-то время она обнаружила, что я в кроватке, все вокруг в говне, а я сижу, выбираю изюм и ем. Спустя дцать лет. Знакомство наших с женихом родителей. Мама начинает рассказывать эту захватывающую историю, я краснею. И тут свекровь ржет и рассказывает как мой почти муж ""зашпаклевал"" говном из своего горшка печку. Так я поняла, что мы созданы друг для друга)))   "
DISGUST,overhear,vk,"Однажды у нас в городе был очень сильный дождь - ливневки не справлялись, весь транспорт встал. Дорога от работы до дома заняла три часа вместо обычного часа. Местами пешком по колено в воде, местами в жутко переполненном транспорте. Взяла пивка на дорожку, чтобы скрасить настроение. Еле доехала. Понимаю, что обоссусь прямо на месте и до дома не дойду. Не придумала ничего умнее, как ссать по дороге прямо в трусы - все равно все насквозь мокрое и люди не заметят.   "
DISGUST,overhear,vk,"Однажды к нам в гости из деревни приехали дальние родственники. Жили у нас неделю, но свои вещи практически не распаковывали. Я как-то в шутку спросила, зачем они каждый раз убирают свои зубные щётки, могут ведь ставить в стакан. Ответ меня шокировал: ""В ванной же полно щёток стоит, зачем нам свои!""   "
DISGUST,overhear,vk,"Много лет назад в нашем небольшом городке прошумела одна история. В одной шашлычной работал шашлычник, который вместо того, чтобы во время жарки шашлыка поливать его водой, просто ссал на него! Однажды в процессе приготовления этого кулинарного шедевра один мужчина, захотев лично отблагодарить повара за самый вкусный в городе шашлык, застал его за ""работой"". Били тогда шашлычника до полусмерти всей компанией...   "
DISGUST,overhear,vk,"Я влюбилась. Да, влюбилась, и всё, как положено: и прогулки под луной, и нежное прикосновение рук, и всхлипы-вздохи, мол, девочка моя, где ты была раньше, и прочее. Моя влюблённость длилась ровно до тех пор, пока меня мой принц в гости не пригласил, а там... В ванной насрато. И принц мне на ушко так интимно шепчет: ""Посмотри, какой шедевр. Я специально для тебя утром сделал!""Да-а-а, говна мне ещё ни разу не дарили. В общем, разлюбила как-то сразу. Насовсем.   "
DISGUST,overhear,vk,"Когда я училась в колледже, к моей одногруппнице в комнату общежития подселили девушку. Вроде бы нормальная она была, чистая. Но через какое-то время после заселения, со стороны ее кровати начала доноситься вонь... никто не мог разгадать эту загадку, пока уж совсем не было сил терпеть этот запах. Девочки дождались, когда их новенькая соседка уйдет по делам, и подняли ее матрас... это была жесть! Кладбище использованых прокладок таилось в ее постели... Позор на всю общагу.   "
DISGUST,overhear,vk,"Недавно болела, а тут с парнем гуляли по набережной, романтика все дела. Мне приспичило харкнуть, прямо так приперло, что дышать не могу. Я сделала вид, что закашлялась и потихоньку эту соплю в рот себе откашляла. Так и ходила с харчей во рту, ждала, пока парень отвернется, чтобы выплюнуть. А он вдруг ни с того ни с сего целоваться полез, и, сука, взасос! Надо было видеть его реакцию, когда он у меня во рту языком своим нащупал эту соплю. До сих пор стыдно.   "
DISGUST,overhear,vk,"Долго уговаривал свою девушку заняться анальным сексом. Согласилась. И вот все прошло замечательно, выхожу из нее, а на моем конце сидит 4 огромных червя. Это было ужасно. Девушку не бросил, отправил к врачу, но и экспериментировать больше желания нету.   "
DISGUST,overhear,vk,"В детстве я с бабушкой ходил на кладбище. Однажды я там увидел плиту, на которой были написаны годы жизни и смерти — одна женщина прожила 117 лет! Я спросил у бабушки, как можно так долго прожить. Она сказала, что знала эту бабулю... Эта бабуля мазала говно об стены, ждала, пока оно засохнет, и ела. Так я узнал секрет долголетия.   "
DISGUST,overhear,vk,"Моя тетя в молодости работала в психбольнице. Естественно, для неё тогда люди с бзиком были вполне себе нормальными. Но вот привезли к ним мужичка: ухоженный, опрятный, вежливый, всегда со всеми здоровался. И тетя всё задавалась вопросом, зачем его сюда привезли. Пошла она мыть полы в мужской туалет и видит картину: сидит этот мужичок и поедает свои ""какахи"". Моя тетя от шока молча смотрит на эту картину, а мужичок, увидев тетю, выдаёт: ""Мое говно, хочу - ем!"". Больше она там не работала.   "
DISGUST,overhear,vk,"Однажды мой друг ходил на педикюр. Рядом с ним сидел пожилой мужчина, и ему тоже делали педикюр. Друга отправила его девушка, и он ко всему отнёсся как к шутке. Мужчине по соседству наскоблили целую кучу отмершей кожи с пяток, на что мой друг не мог смотреть без смеха и отвращения. Тут дунул вентилятор, и все эти ошмётки полетели в лицо хохотуна.   "
DISGUST,overhear,vk,"Одним из самых страшных воспоминаний детства была бабушка, бегающая за мной с тазиком мочи. Убегая и прячась от нее по комнатам, я готова была на все, лишь бы не умываться зловонными отходами жизнедеятельности. Но бабушка в итоге ловила меня и умывала насильно, читая при этом молитву. Объяснялось это тем, что я становлюсь здоровее и кожа чище (у меня веснушки). Это продолжалось около двух недель, потом я нажаловалась маме. Мозги были вправлены всем: и соседям, посоветовавшим это, и бабушке.   "
DISGUST,overhear,vk,"Встречаюсь с парнем, он вегетарианец, думает, что я тоже. В один день я чувствовала себя плохо, весь день, прихожу домой, садимся ужинать, ничего не предвещает, и тут он достаёт кольцо. То ли от нервов, то ли просто пришло время, меня тошнит прямо на стол. Вот так он узнал, что я не вегетарианка. Замуж я не выхожу, но может и к лучшему. Пойду пожарю стейк.   "
DISGUST,overhear,vk,"Была у нас в институте преподавательница, которая любила говорить, что от настоящей женщины должно всегда пахнуть одними и теми же духами, чтобы этот запах ассоциировался с ней и вызывал воспоминание о ней. Сама она прочно ассоциировалась у нас с запахом немытой тётки, а посещение, пардон, общественного сортира вызывало её стойкий образ.   "
DISGUST,overhear,vk,"Когда я училась в начальных классах, в школьной столовой однажды увидела, как повариха случайно уронила грязную тряпку, которой вытирали столы, в огромную кастрюлю с борщом. Вытащила её оттуда рукой, увидела, что я ошарашенно смотрю на всё это, и посмеялась. Больше я никогда не ела супы в школьной столовой. Да и вообще ничего больше не ела там.   "
DISGUST,overhear,vk,"Пригласил девушку домой, смотрели фильм, пили вино и кушали пиццу. Когда дело дошло до интима... в квартиру заходит мама. Я прячу девушку под одеяло и держу рукой её голову, второй рукой одеяло. Мама проходит мимо, и делает вид, что ничего не видела. А она просто забыла дома какую-то вещь, поэтому вернулась. От волнения я испортил воздух, там, под одеялом. Да! Где была девушка. Она начала брыкаться, я продолжал её держать... После того вечера я больше её не видел.   "
DISGUST,overhear,vk,"Как-то в детстве на даче мы с друзьями решили выкопать землянку, чтобы в летнюю жару там сидеть в прохладе. Выбрали место и начали усердно копать в пять пар детских рук. Через полчаса нас заметила бабушка и быстренько прекратила ""работы"". Оказывается, копали мы вплотную к деревенскому туалету. Ещё немного и наша землянка превратилась бы в фекальный бассейн.   "
DISGUST,overhear,vk,"Неловкий момент, когда у тебя на свидании случился понос, и в туалете в ресторане не оказалось бумаги, пришлось выискивать в мусорке наиболее чистые и сухие бумажки (что отвратительно!), чтобы привести себя в порядок. А потом встать с унитаза и увидеть позади целый рулон туалетной бумаги!   "
DISGUST,overhear,vk,"Долго мечтала, столько же копила. Поставила себе брекеты к празднику! Счастлива до одури! Один случайно отклеивается и слетает во время еды. Проглотила нечаянно. ""Коррекция"" с новым элементом ~2-3трЭто дорого. С финансами тяжко было. Короче, два дня я в какашках ковырялась, но нашла его. Отмыла, продезинфицировала, доктор приклеил обратно бесплатно.   "
DISGUST,overhear,vk,"Пришли гости, ты бегаешь вся в мыле, накрываешь на стол, и это непередаваемое чувство, когда уже расслаблено сидишь полвечера и вдруг вспоминаешь, что в запаре забыла выбросить использованную кровавую прокладку, а в туалете уже побывала добрая половина гостей. Кроме меня и мужа. И охватывает дикое желание сиюсекундно провалиться под пол и больше никогда не появляться...   "
DISGUST,overhear,vk,"Живу в общаге в комнате с двумя соседками. Недолюбливаю их. У одной из них есть какая-то специальная тряпочка для лица, и она её сушит на батарее в нашем совместном санузле. Сегодня увидела, как вторая соседка вытирает этой тряпочкой ободок унитаза. Не знаю, говорить ли им правду.   "
DISGUST,overhear,vk,"Ехала в автобусе поздно вечером. В салоне не было никого, кроме меня и одного парня. Он шибко активно пытался познакомиться. Я отшивала как могла, но он был не преклонен. И не найдя другого способа оттолкнуть от себя - пёрнула на весь салон. Он секунду смотрел на меня выпучив глаза. Через две пёрданул не тише меня. Задумалась. Пять лет вместе, через месяц родится дочка.   "
DISGUST,overhear,vk,"Я жутко замороченная на приличиях. Бесит, когда муж, чихая, не прикрывает рот или случайно отрыжку громко делает. Моментально капаю на мозг. Всё закончилось после того, как я во сне пукнула на всю комнату и от этого звука проснулась. Муж тоже. Ржал долго. Теперь, как только я начинаю читать мораль про приличия, он говорит: ""Кто бы пердел!""   "
DISGUST,overhear,vk,"У родителей мужа есть кот, сидит на коленях исключительно у мужчин. Моего мужа игнорирует, отец часто подшучивает. Как-то оставили кота у нас, и ночью тот залез в корзину с бельём для стирки, утащил трусы мужа (из-за задержки рейсов муж провёл в них три дня, а так он крайне чистоплотный), улегся на них и отказался встать, даже за вкусняшки. Короче, кот обожает застарелый запах немытых хуйцов. Проверили и перепроверили - только этот ""аромат"" его влечёт. Не знаем теперь, как смотреть на отца мужа.   "
DISGUST,overhear,vk,"Раньше я работала в салоне эротического массажа. В один прекрасный день к нам пришёл парень и выбрал массаж, где его будут мять две девушки. Мы начали массажировать его заднюю поверхность, спустились к ягодицам, но на торчащих из его промежности волосах было говно. Сдержать смех было крайне тяжело. Всё бы ничего, но с того момента в моей профессиональной деятельности началась череда нечистоплотных мужчин. Все эти состоятельные, ухоженные мужчины приходили ко мне... С грязной жопой.   "
DISGUST,overhear,vk,"В детстве папа купил в магазине трехлитровую банку любимейшего мной томатного сока. С каким удовольствием пила его вся семья. Ровно до тех пор, пока сока не осталось на донышке банки и не стало видно дохлую мышь.   "
DISGUST,overhear,vk,"На днях моя 75-летняя бабуля отхуярила моего парня ёршиком для унитаза, перед этим воспользовавшись им по назначению...  #Подслушано_бабушки@overhear"
DISGUST,overhear,vk,"Моя приятельница проходила интернатуру в нашей больнице. Привезли как-то парня в истерике. Он орет, вопит, слезы. В общем, он проглотил мышь... живую мышь. Фокусы показывал с любимцем друзьям. И допоказывался. Задал жару врачам. В итоге ему дали двухлитровую банку с марганцем и посадили пить. Понаблюдали сутки и отправили восвояси выкакивать мышь.. Главврач сказал, за 40 лет работы такого не встречал в желудках пациентов.   "
DISGUST,overhear,vk,"Работаю на износ по ночам в баре, чтобы снимать комнату, а днем учусь. В общагу больше ни ногой, с тех пор, как поймала соседку за тем, что она мне в питье свои месячные подмешивала, якобы для приворота. Так я узнала о ее ориентации и то, что лучше уж я буду пахать, зная, что никто ничего из моих вещей не трогал и не подмешивал в еду.   "
DISGUST,overhear,vk,"Однажды в детстве мама приготовила мне на завтрак яйцо всмятку (я их тогда очень любил). Сняв скорлупу сверху, как сейчас помню, белок был странноватого цвета. Когда я его съел, и не глядя засунул очередную ложку в рот, я заорал от страха: яйцо внутри было темно-зелёное и в нем что-то плавало. Я выплюнул, то, что у меня было во рту, а это была ГОЛОВА ЦЫПЛЕНКА... Такая мерзкая, противная... Казалось бы: не самая большая неприятность в жизни, но мне скоро 25. И вот прошло 17 лет с того момента, как я в последний раз ел яйца...   "
DISGUST,overhear,vk,"Общественный туалет. Очередь. Тут из кабинки наконец выходит невероятной красоты девушка: фигура, волосы, макияж, одежда - сущая топ-модель. Я аж ""варежку"" разинула, меня крючит - на атомы от зависти распадаюсь. Эта красотка, поправила волосы, залезла мизинцем в баночку с бальзамом и намазала им губки. И пошла. Я как представила, что она, посрав, вытерев жопу и нажав кнопку на общественном унитазе, руки не помыла, так меня зависть и отпустила. Потом смотрю, парень ее в эти губки целует. Бррр.   "
DISGUST,overhear,vk,"Служил в армии поваром, вода из-под крана текла плохая, из-за чего трескалась кожа рук, а для повара это трагедия. Один раз месил тесто и из ранок текла кровь, несильно, но все равно. Тесто не выкинешь, все продукты израсходовал. Вся часть ела сладкие булочки с кровью.   "
DISGUST,overhear,vk,"Раньше я много курила. И в шкафчике с крупами хранила несколько сигарет в качестве заначки. И вот, ночью, дошло дело и до них. В темноте подкурила, вдохнула жуткий, вонючий дым. Не поняла. Еще затяжка. Очень мерзко. Подсвечиваю зажигалкой и вижу, что при нажатии на фильтр из него вылазит нечто, как гной из прыщей. Включаю свет, и вижу, что в фильтре и в табаке шевелятся белёсые червячки. Вкус горелых червяков не забуду никогда. Но самое противное в этой истории то, что я так и не бросила тогда курить.   "
