emotion,source_name,source_type,text
DISGUST,overhear,vk,"Друзья спрашивают, как я вдруг смогла отказаться от мяса, стала веганом в их понимании. Всегда отвечаю, что любовь к животным и милосердие двигают рукою моею. Однако только я и еще пара человек знают, что, пока я была в отъезде, кто-то обесточил квартиру. И когда спустя три недели я вернулась, холодильник и морозильник со всем мясом, рыбой, пельменями пропах таким ароматом тухлятины, что разъедало глаза. После разборки и чистки не могу смотреть на мясо — сразу чувствую тот трупный запах.   "
DISGUST,overhear,vk,"В случае засора раковины или душа у себя дома обожаю вытаскивать пальцами намотанные клоки волос из слива, ощущать контакт с ошмётками чего-либо и видеть после этого, как вода свободно уходит вниз. Получаю странное удовольствие от этого и улыбаюсь. Средства от засоров покупаю редко. Это слишком просто, скучно, и не возникают никакие эмоции от такого бытового действия.   "
DISGUST,overhear,vk,"Пошла в кафе на первое свидание с парнем, с которым познакомилась в интернете. Он оказался тощеньким, робким, но чем-то зацепил меня. Всё свидание мы проговорили, было здорово, хотя видно было, что он очень волновался. То ли нервы его сдали, то ли роллы были не первой свежести, но после первого поцелуя он очень громко, жидко и вонюче обдристался. Он покраснел невероятно и просто убежал в ночь, оставив меня в тёмном дворе холодным октябрём. Неделю мы молчали, потом я не выдержала и написала ему. Всё-таки он мне понравился, а то, что произошло… ну, бывает же. Он долго молчал, потом ответил. На втором свидании всё прошло без эксцессов, на следующих тоже. Сейчас этот паренёк — мой муж уже восемь лет. Он могуч и бородат. Если что-то идёт не по-моему, или мне что-то хочется, а он не разрешает или не даёт, я шантажирую его тем, что расскажу нашим друзьям про первое свидание. И всё — муж сдаётся! Я, конечно, никому это не расскажу, но мне нравится шантажировать моего засранца!   "
DISGUST,overhear,vk,"Подогрела себе сосисочки. «Ну что же может быть лучше после тяжёлого рабочего дня?» — подумала я. Что-то твердое попалось; выплюнула в руку, а там огромный, блять, кусок ногтя, покрашенный розовеньким лаком. Сосиски больше не ем.   "
DISGUST,overhear,vk,"У нас в садике в компоте всегда плавали гусеницы, потому что никто не перебирал сухофрукты. Мелкие такие, белые, жирные червячки. Мы даже соревновались, кто больше выудит из стакана. Травма не выросла, компот пью. Правда, сухофрукты не слишком люблю, так их никто не любит.   "
DISGUST,overhear,vk,"Конец 80-х, первый класс, я такая восторженная девочка-цветочек в форменном платье и бантах иду на перемене по коридору, а навстречу несётся расхристанный пацан и что-то на веревке крутит. Подлетает ко мне и шмяк этим мне в лицо. И, смеясь, побежал дальше. По лицу сползают кишки и шкурка убитой крысы, кровь на белом воротничке и фартуке. Что дальше было — не помню. Учительница меня отмывала в туалете с мылом, а я рыдала так, что глаза опухли, и нос заложило.   "
DISGUST,overhear,vk,"Любили в детстве с подругами ходить в лес, а там были трубы огромные, был завод, где намывали песок для изготовления кирпича. И мы постоянно лазили и ходили по этим трубам. И одна подруга как-то упала с этой трубы. Говорит, что-то мягкое: упала она на труп уже разложившейся собаки.   "
DISGUST,overhear,vk,"В школьном возрасте думала, что это нормально, что со временем любые стержни покрываются какой-то жёлтой гущей, которую нужно вычищать, чтобы они писать продолжали. Только в старших классах случайно от отца узнала, что он всеми стержнями чистил себе уши. ""И что такого? У меня ушные каналы узенькие, нужно что-то тонкое"". Чёрт побери, нужно именно мои стержни, именно из моих ручек вывинчивать, а потом завинчивать обратно, даже не почистив.   "
DISGUST,overhear,vk,"Соседка после родов увлеклась приготовлением выпечки, тортов и всего разного из теста под заказ. Всё хорошо, деньги в декрете зарабатывает, но она добавляет в тесто своё грудное молоко.   "
DISGUST,overhear,vk,"Пошла в кино на вечерний сеанс. Фильм был супер, а вот «девочки» на ряду позади меня... Сначала они громко разговаривали, ржали, подпевали песням, постукивали ногами, типа танцуют. В конечном итоге одна из них, вероятно от количества выпитого алкоголя, наблевала в ведро с попкорном. О чем, конечно же, сообщила, и что попкорн ей жаль тоже. Нихрена она не вышла из зала, была ужасная вонь на весь зал, но фильм так хотелось досмотреть.   "
DISGUST,overhear,vk,"Любимым занятием в седьмом классе среди мальчишек было харкать или сморкаться в карманы девчачьих курток в раздевалке. Кто-то даже на выходные копил харчу в стакане, а потом приносил в школу и выливал девочкам на волосы. Были скандалы и вызов к директру. Родители ругались между собой. Тогда нам казалось это весёлым. Сейчас понимаю, что это дичь. Даже жалко девочек теперь. Они причёсывались, мыли голову перед школой, а их харчёй обливали.   "
DISGUST,overhear,vk,"Утро, любимый ещё спит, жарю купаты на завтрак. Вдруг припёрло по-большому, решила, что по-быстрому, оставила всё на газу. Сижу на унитазе и понимаю, что халат, в котором я была, одной стороной в унитазе. Матюгнулась, достала, сижу дальше. Закончив, встаю и, ёб твою мать, вся ляжка и халат в говне. Видимо, я насрала на халат, и, когда вставала, всё осталось на мне. Вонь адская, ещё и милый проснулся, тоже в туалет стучится. Прыскаю освежителем, моюсь, халат в стирку. Еще и купаты, блять, сгорели.   "
DISGUST,overhear,vk,"У меня глисты уже довольно долгое время. Врачи пытаются меня заставить лечиться: выписывают таблетки, направления на процедуры. А я не хочу всего этого. Мне нравится. Нравится прийти после тяжёлого рабочего дня домой, сесть поудобнее и начать вытягивать из задницы этих червячков. Понимаю, что это может плохо кончиться, но те ощущения не сравнятся ни с чем.   "
DISGUST,overhear,vk,"Когда мне было около трёх, я ещё ходила на горшок, и старшей сестре влетело от мамы за то, что мы со средней разрисовали обои. После мама отошла в магазин, с нами остался папа, но он был в другой комнате и смотрел телевизор. Я как раз решила покакать, и старшей сестре пришла в голову идея отомстить. Она дала нам счётные палочки, сказав: ""Если мы их обмажем какашками и проведём по разрисованному месту на обоях, то рисунок сотрётся"". В общем, в нашей комнате решили сделать ремонт.   "
DISGUST,overhear,vk,"В период бурной молодости на пьянке внезапно закончилось пиво, я была расстроена, и мне очень хотелось ещё, прям до трясучки. Я как раз вышла из уборной и начала поиски по дому; подруга и другие товарищи уверяли, что больше пива нет. Но я нашла спрятанную пластиковую бутылку и жадно начала пить: вкус показался странным и разбавленным. Оказалось, один из парней, пока уборная была занята, нассал в бутылку, а я это выпила. Сразу протрезвела от отвращения.   "
DISGUST,overhear,vk,"Есть у меня знакомая пара — ярые противники бытовой химии, а также уходовой косметики типа дезодорантов. По странной иронии, несмотря на то, что они следят за собой — красивые, стройные, ухоженные — запах пота у обоих очень сильный и неприятный. И стоит надеть вещь один лишь раз, запах впитывается мгновенно. Давала я им как-то пару своих футболок, вывела вонь только через несколько стирок.   "
DISGUST,overhear,vk,"Мой муж — золотой человек. Он замечательный семьянин, добрый, ласковый и нежный мужчина. Его ценят на работе, но и по дому он может абсолютно всё. Эти и другие слова я повторяю себе, когда в очередной раз закидываю в стиралку его труханы с коричневыми дерьмопятнами.   "
DISGUST,overhear,vk,"Через несколько дней после Нового года зашла соседка с бокалом и бутылкой шампанского. Я предложила Мартини. Посидели час, соседка отлучилась в туалет, её долго не было. Пошла в ванну мыть руки и опять пропала. Иду её проверить. Эта сука заблевала мне весь туалет, ванну и коврики. Насильно спровадила нежданную гостью. Блять, ну, ладно пить к 40 годам не научилась, но блевать-то аккуратно в гостях постаралась бы! Теперь шкерится от меня и дверь не открывает. Я давно всё отмыла, просто бокал вернуть хочу!   "
DISGUST,overhear,vk,"Как-то ночью встала в туалет, включила свет, села, как вдруг прямо перед моими ногами что-то упало и зашевелилось. Это была жирная мокрица! Я подняла голову и увидела, что ещё три мокрицы лезут из всех щелей навесного потолка. Я выбежала оттуда с диким криком и вовремя: они начали падать на пол! Через время вернулась туда с тапком. На полу сидел кот и лапкой катал половину одной мокрицы, другую дожёвывал. Остальных, видимо, он уже сожрал.   "
DISGUST,overhear,vk,"Сидела на детской площадке и смотрела, как братик играет. Рядом села женщина, судя по всему, ей было нехорошо. Когда я спросила, всё ли в порядке, её вырвало себе под ноги. Она внимательно посмотрела на лужу блевотины, потом достала оттуда что-то и положила в рот. На мой немой ужас сказала: «Таблетка дорогая очень, а я её только недавно выпила».   "
DISGUST,overhear,vk,"В детстве во дворе с подружками собирали использованные презервативы и упаковки от них и складывали их под камень за домом. У нас там была своеобразная коллекция. Сейчас понимаю, какой это пиздец: брать в руки эти презервативы со спермой, которые побывали в чьей-то пизде, а тогда не знали даже, что это такое. Как только не заразились ничем, ведь на улице проводили весь день. Вытирали руки от склизкой массы о шорты и дальше бегать.   "
DISGUST,overhear,vk,"Заклеиваю камеру на ноутбуке не потому, что боюсь ФСБ. А делаю это по причине того, что боюсь, что мой парень-программист взломает мой ноут и увидит, как я ковыряюсь в носу и ем козявки.   "
DISGUST,overhear,vk,"Имею мерзкую привычку, когда пукаю, подставлять руку и нюхать. В обществе-то я себя сдерживаю, а вот дома ничто меня не остановит. Однажды лежали с молодым человеком, смотрели фильм, и я настолько была увлечена сюжетом, что, когда оно самое подкатило к моей жопе, я машинально подставила и понюхала руку. Так как это было начало отношений, парень такой перфоманс мне не простил. Вот так я и пропердела парня.   "
DISGUST,overhear,vk,"Родные не понимают, почему я с каждого кусочка мяса снимаю любой жир, даже с курицы. Просто однажды в детском саду нас кормили макаронами с мясом. Так у меня была тарелка сплошного жира вместо мяса. Естественно, я отказывалась это есть. Воспиталка на это лишь взбесилась и начала впихивать всё в меня, от чего меня вырвало. Но даже после этого она пыталась запихать в меня мою же блевоту. С тех пор я просто не переношу жир в еде. Родные в курсе, но называют это детской придурью.   "
DISGUST,overhear,vk,"Было мне четыре года. Приехали к бабушке в село, у нее печка, отопление и готовка на печи. И там бегали тараканы; один упал на печку, сжарился. Мама его на край печи отодвинула и говорит мне в шутку: «Будешь жареного таракана?» А я, вместо брезгливости и вопроса, а можно ли, просто закинула его в рот. После крика мамы: «Выплюнь быстро!», я обижено достала снек изо рта и недоуменно спросила: «А почемуу?» Больше мама со мной так не шутила.   "
DISGUST,overhear,vk,"Моя знакомая, будучи пьянющей вусмерть, переспала с парнем на тусовке во время менструации, а потом спустя почти неделю пошла к гинекологу, потому что что-то её там беспокоило. В итоге оказалось, что у неё там тампон ещё с того раза. Парень ей просто его туда вогнал, а она даже не потрудилась его вытащить перед сексом.   "
DISGUST,overhear,vk,"Мой бывший был довольно богатый и известный в узких кругах. Имеет сырный бизнес. Когда встречались с ним, он все время угощал меня своими сырными экспериментами — то торт сделает, то мороженое. Однажды от его сестры узнала, что он, желая меня влюбить в себя, накончал в сыр, которым позже угощал меня. Больше удивило то, что его сестра говорила об этом спокойно, а когда я назвала бывшего ебланом, то она мне ответила, что сама и посоветовала ему такой метод обольщения.   "
DISGUST,overhear,vk,"Года три назад какой-то урод сначала дрочил на меня в трамвае (мы стояли в конце вагона), а потом кончил мне на спину, когда я отошла подальше. Рядом стояли парни, но никто ему даже слова не сказал. Я жила с этим очень долго, стараясь забыть и тут... Этот «человек» пришёл устраиваться ко мне на работу ПОВАРОМ! Не передать, что со мной происходило, пока я проводила собеседование! Так и хотелось сказать: «Простите, Вы мне спину три года назад обкончали, на работу я Вас не возьму».   "
DISGUST,overhear,vk,"Ехала в маршрутке, стояла рядом с сидящим на одиночном месте мужчиной. Почему-то начала следить за его действиями, хотя обычно так не делаю, чем-то он привлёк взгляд. Мужчина был ухоженный, приятно одетый, копался в телефоне. И вот он копается дальше, видимо, экран замарался, и он облизал экран телефона, и вытер о брюки, и так раза 4-5. Чуть не блеванула, представив, сколько микробов было на телефоне и в его рту, и всё это перемешалось.   "
DISGUST,overhear,vk,"Мы живём в доме, в котором тараканы живут везде, даже в подъезде. После капитального ремонта в квартире мы видели их крайне редко. Когда отодвинули плиту на кухне, освободили доступ под шкафчики, я решила там убраться: всё под шкафом с раковиной было усеяно тараканьими экскрементами и трупами. Я сняла все заглушки, насквозь обгаженные этими тварями. К счастью, живые мне не встретились, но всё равно — это просто ужас какой-то, тошнит до сих пор.   "
DISGUST,overhear,vk,"Всех людей, с которыми езжу с утра в маршрутке, знаю в лицо. И никогда не сажусь с одним дяденькой, если это единственное место. Потому что он невероятно вонюче, но тихо, бздит. Аж сидеть жарко становится. При этом делает он это, только если рядом появляется сосед. До этого, видимо, терпит. Так хочется проучить этого пердельных дел мастера, что сил нет. Вопрос — как.   "
DISGUST,overhear,vk,"Мама не разрешила девятилетней мне остаться с ночёвкой у бабушки, громко заявив: ""У тебя же месячные! Вонять будешь как дохлая кошка!"" Тогда бабушка разрешила ситуацию, сейчас с мамой отношения ровные. А привитое бабушкой понятие такта не позволяет сделать маме замечание о том, что ей пора регулярно пользоваться урологическими прокладками. И стирать, а не сушить обоссанное белье на включенном радиаторе, потому что вонь просто глаза выедает.   "
DISGUST,overhear,vk,"Когда работала менеджером по продажам, основной обязанностью было подписание договоров. Для этого делала копии документов клиентов. Вот однажды привычно заполняю бумаги, открываю паспорт сидящего напротив мужика, а у него за прозрачной обложкой лежат молочные зубы. С кариесом. Два зуба. Я думала меня стошнит тут же. С диким лицом засунула этот паспорт в ксерокс, быстро все подписала и час мыла руки потом. Фу. Он бы ещё пуповину засунул в паспорт в знак своей отеческой любви...   "
