text,emotion,source_type,source_name
"Он рассказывает всегда такие забавные вещи! Вот, например, как тебе такая история? Живую энергию, которая пронизывает и связывает все вокруг, китайцы называют ци. А влиять на ци можно музыкой. И музыкальными звуками определять насыщенность ци. Раньше, чтобы выяснить, готова ли армия к бою, музыкант становился среди солдат, дул в специальную трубу и по звуку делал свое заключение. Если труба звучала ослабленно, то и воинский дух был соответствующий, что предсказывало поражение в бою. В этом случае полководец приказывал своей армии не начинать сражения и отступить. Улыбнулась?",excitement,book,pismovnik
"Все здесь исходят из того, что осажденных в дипломатическом квартале Пекина, которых мы идем спасать, уже нет в живых. Освобождать, увы, больше некого. Те, кому удалось вырваться, говорят, что в городе устроили резню, европейцев никого не оставили в живых, а миссии сровняли с землей. Еще держится европейский отряд в окруженном Тяньцзине, там идут тяжелые бои. Нас отправили на выручку. Наверно, завтра или послезавтра мы прибудем туда.",distress,book,pismovnik
"У меня удивительное ощущение, как будто я участвую в образовании новой планеты, которая от меня в свой положенный срок отпочкуется, будто я – сестра жизни и вообще близкий родственник каждому дереву. Но так ведь и есть. Треплю Доньке загривок и думаю: псина моя, у нас ведь с тобой общий белковый предок, понимаешь? Она понимает! Вот у нее пупок и у меня. И мы этим пупком связаны. Чешу ей пузо, и она счастливо машет хвостом. И я вместе с ней битком набита счастьем, только хвоста нет, чтобы так же радостно стучать им по паркету!",excitement,book,pismovnik
"Ты знаешь, мне в детстве приходили в голову иногда совершенно странные мысли. А может, и не такие странные. Кто-то подарил нам французские печенья в красивой жестяной банке, и вот я думал, что бы с такой замечательной банкой сделать. Потом придумал – ведь в нее можно положить разные вещи и закопать, а когда-нибудь кто-то мою банку найдет и все обо мне узнает. Я положил туда мою фотографию, какие-то рисунки, марки, всякую мелочь, которая забивала ящики стола, – камушки, солдатики, карандашики, еще такую же ерунду, мне тогда важную, и закопал на даче под кустом жасмина. А потом мне пришло в голову, что через много лет, когда эту банку найдут, меня уже не будет, и мамы, и вообще никого. И нужно положить в банку что-то от мамы тоже. Я вытащил тайком из альбома ее фотографию и тоже закопал. А потом меня поразила мысль, что я обладаю удивительной властью – останутся только те, кого я возьму с собой в мою банку!",excitement,book,pismovnik
"И иногда вдруг теряется связь, то есть перестаю понимать очевидные вещи. Вот не понимаю, откуда взялись в моей жизни эти люди вокруг. Почему я сейчас в этой отсыревшей и прокуренной палатке с ними – гогочут, снимая портупеи, от них разит ханьшином, один выдул из ноздрей два дымных клыка, у другого по лбу красная полоска от фуражки, у третьего на черепе ни единого волоса, кожа блестит, как тонкая папиросная бумага. А теперь они ругаются, обсуждая действие мелинитовых снарядов.",startle,book,pismovnik
"«Спустился вечером пройтись вокруг дома. Как хорошо – просто пройтись в одиночку! Трахнет инсультом – и поумнеешь сразу, начнешь разбираться в хорошем. Остановился передохнуть – смотрю, сверкнуло что-то на асфальте, отразило свет фонаря. Это прополз червяк или слизень – оставил свой след в жизни, да и то не в своей, а в моей. И попал даже на эту страницу. И никогда об этом не узнает. Почему-то стало от этого весело. Захотелось запрыгнуть на скамейку и станцевать чечетку, как тогда. Сколько же мне, балбесу, было?»",excitement,book,pismovnik
"Про иностранные посольства в Пекине уже достоверно известно, что они уничтожены, а все европейское население вместе с китайскими христианами перебито. Китаец, служивший при немецком посольстве, чудом спасся и рассказывал про то, что досталось и русской миссии в Пекине: сожгли храм, подворье с библиотекой, больницей и школой. Сила ненависти такова, что уничтожили даже православное кладбище, все могилы разрыли и кости разбросали. На его глазах русской семье, жившей при миссии, вспороли животы и отрубили головы.",startle,book,pismovnik
"Несколько раз не получалось, оно выскакивало, прыгало на паркет, но один раз получилось! Это было очень красиво – такой сквозной полувоздушный золотой шарик выписывал круги по подоконнику и позвякивал. Особенно мне нравился звук, когда кольцо уже вращалось на одном боку и дробно билось, прежде чем замереть. А когда я щелкнул по нему ногтем еще раз, кольцо выпрыгнуло в окно.",enjoyment,book,pismovnik
"И в плен они никого не берут. Расправляются со своими жертвами с какой-то недевичьей жестокостью и обязательно должны надругаться над бездыханными телами. Расчленяют их, скармливают свиньям, а сердце съедают сами. Но это не простое варварство, в этом заложен глубокий смысл. Они ведь, эти летающие девочки, не могут себе представить, что чей-то сын и без того не воскреснет, никогда больше не повторится – ни на третий день, ни на сто тысяч третий».",fear,book,pismovnik
"Кончились изматывающие поездки в больницу, должно было бы стать легче без рака, уколов, уток, рвоты, стонов, запахов гниющего тела, но поймала себя на том, что привыкла ездить к маме и по дороге думать о том, как расскажу ей вечером свой день, и хорошее, и плохое, как находилась, настоялась, намучилась, как мне было тяжело – и как все в конце концов удалось.",distress,book,pismovnik
"Помню, когда отец рассказывал, как ему пришлось заночевать в тундре в такой яранге и в качестве особого лакомства ему предложили грызть оленью кость с мозгом, мама выглянула из кухни и спросила, правда ли, что у этих оленьих людей по закону гостеприимства хозяин предлагает гостю на ночь свою жену. В ее голосе мне почудилась какая-то странная интонация, будто она сомневается в его рассказах, и мне стало ужасно обидно. А папа рассмеялся и сказал, что хозяин, разумеется, предлагал ему свою жену, но она была старая, вся в язвах, а волосы сбились в войлок и кишели паразитами, что неудивительно, поскольку оленьи люди ни разу в жизни не моются от колыбели до могилы.",excitement,book,pismovnik
"Хочется дождя, но ему устав не писан. Все тут мечтают о дожде – можно было бы набрать чистой воды. Наши солдаты выкупались в Пейхо – появилась сыпь по всему телу. Доктор сказал, что от трупной жидкости. В вырытых колодцах воды мало, и она плохая. На ночь оставляют у каждого колодца охрану – боятся, что отравят.",distress,book,pismovnik
"С Кириллом бродили по арсеналу и поражались его богатствам. Тут оружейные мастерские, склады, лаборатории. Здесь же чеканили китайскую медную и серебряную монету. В огромных залах был целый завод, где изготавливали порох и делали ружейные патроны для винтовок Маузера и Манлихера самой последней модели. В подземных складах хранятся огромные запасы гранат разного сорта, фугасов, шрапнели. Кирилл переводил мне китайские надписи. Например, «Хранилище подземного грома» обозначает «Склад мин», а «Жилище водяного дракона» на самом деле всего-навсего «Депо пожарных инструментов».",startle,book,pismovnik
"Сегодня Кирилл практиковался в своей каллиграфии, и мне так захотелось попробовать, что не удержался и тоже сделал несколько мазков. Глазенап снисходительно заметил, что мой мазок напоминает секцию бамбука, чем я несказанно возгордился, но, как оказалось, зря. Представляешь, мазок кисти не должен напоминать ни голову овцы, ни хвост крысы, ни ногу аиста, ни сломанную ветку, то есть вообще ничего реального. Теперь-то я знаю, что горизонтальный мазок подобен облаку, простирающемуся на десять тысяч ли. Я решил каллиграфией больше не заниматься.",neutral,book,pismovnik
"Так люблю смотреть, как она играет с этим невидимым существом, кормит его, поит чаем. Так и не знаю, что это за зверек. Зайка заботливо дует ему на блюдечко, чтобы не обжегся. Пилит его, чтобы он не полоскал во рту чай, перед тем как проглотить. Смочив слюной платок, оттирает ему грязь на лице и ругает с моей интонацией. А когда он заболеет, лечит его особым лекарством – запахом шоколада, который у нее хранится в большой коробке из-под новогодних конфет.",excitement,book,pismovnik
"Все смотрели на нас, и я не мог выносить эти сочувствующие взгляды, эти придыхания в сторону: «Какой ужас!» или «Не приведи Господь!». И вести его нужно было плавно, без резких движений и рывков, иначе он начинал сердито выговаривать мне и больно сжимал руку. Помогать ему нужно было уметь. Он бесился, когда сердобольные люди хотели помочь ему и хватали за руку с тростью. А попробуй провести его мимо всех луж, если дождь!",distress,book,pismovnik
"– Все эти шаровые скопления и диффузные туманности для нас как фотокарточка, чик – и навсегда. Вот был когда-то Большой взрыв. Ба-бах! Все разлетелось. Но это для нас разлетелось. А на самом деле – быстро разлетелось и быстро собралось обратно. Снова ба-бах, опять разлетелось, опять собралось. Опять бабах. Как бы тебе это попроще объяснить? Ну вот как ребенок берет кусок пластилина, лепит из него зверушек, человечков, деревья, домики. Потом скатывает, сминает все в один ком. А завтра опять принимается лепить. Или, вернее, так: помнишь ту старуху у парка? Это для нас вечность, а на самом деле это просто как аккорд на гармошке – развел руки, сжал. Развел, сжал. Понимаешь?",neutral,book,pismovnik
"Мне так не хватает твоих писем! Мы все ждем тут почту, но ее нет и, скорее всего, в ближайшее время не будет. Где-то твои письма колесят. И обязательно попадут ко мне – где бы они ни были. Жду и жду – и все равно дождусь. Получу, наверное, сразу целую охапку. Они где-то скапливаются, а потом хлынут, как через запруду…",distress,book,pismovnik
"Подумал, что секрет дежавю, наверно, заключается в том, что в книге бытия все это написано, конечно, только один раз. Но оживает опять, когда кто-то снова читает ту страницу, которая уже была когда-то прочитана. И тогда снова оказываются живы и эти обои, и прутик по штакетнику, и пахнущая вблизи рыба, повешенная на шпингалете, и шуршание этой щетины, и чайник с холодной заваркой, и женщины еще таинственны.",neutral,book,pismovnik
"Мы зашли с Убри в Гордон-Холл, муниципалитет английской концессии. Он рассказал, что здесь, в подвалах, во время осады укрывались женщины с детьми, а еду им готовили в соседней гостинице «Астор-Хаус». Там же, в подвалах Гордон-Холла, провел осаду и русский консул Шуйский с семьей. У него во время обстрела погиб семилетний сын.",neutral,book,pismovnik
"Я хочу все время забраться подальше от берега, на глубину – папа не пускает, я принимаюсь его топить, хватаю за плечи, тяну за уши, за волосы – он отбивается, хватается за скользкий столб, выныривает, фыркает, капли блестят на ресницах, он хохочет. Вылезаем на деревянные мостки, идем по настилу, стараясь не занозить ноги о доски, шершавые, изъеденные солью. Бежим к маме, оба трясемся, кутаемся в полотенца, стучим зубами.",enjoyment,book,pismovnik
"Перед тем как пойти к ней, я спустилась во двор, чтобы собраться с силами. Захотелось глотнуть свежего, небольничного воздуха. На улице шел легкий снежок, и дворник лопатой сгребал его в сугробы. Пробежала кошка, и мне на минуту показалось, что это моя Кнопка, позвала ее, но это была Кнопка в новой шкурке.",neutral,book,pismovnik
"Еще у отчима было весьма своеобразное чувство юмора. Например, ест яблоко с ножом, очищает кожицу, держит отрезанную дольку на кончике ножа и рассказывает, смеясь, как на улице немолодая женщина довела его до почтамта, а на прощание жалостливым голосом сказала: «Чем так, лучше уж совсем не жить!» Отчим не удержался и ударил ее тростью. Он так рассказывал, будто хотел, чтобы все над этой историей весело посмеялись.",disgust,book,pismovnik
"Однажды я поняла, что именно я в ней не люблю. Она – женщина, у которой все правильно в жизни – все именно так, как она и хотела, – и никак иначе быть не может. Она всегда знала, чего хочет и как этого добиться. И с мебелью так, и с людьми. Она и в школе была пятерочницей. И подруги у нее были какие-то несчастные, которых она учила всегда, как надо жить. И внутри презирала их за то, что они так не могут, что у них все не по-людски. И всегда наклеивала фотографии всех наших отпусков в фотоальбомы, где счастье было запротоколировано. Она хотела и меня, и отца подогнать под свои фотоальбомы. А ничего не получалось.",neutral,book,pismovnik
"Когда выпадает возможность, Глазенап занимается каллиграфией. У него целый набор кисточек. А тушь в брикетиках – палочки, которые он натирает в каменной тушечнице – в лунке с водой. Но бумаги мало, и он часто пишет на доске или холстине, окуная кисточку в простую воду. Несколько иероглифов, написанных сверху вниз, образуют стихотворение. Когда он дописывает стихотворение до конца, начало уже начинает исчезать от солнца и ветра. Сашенька, если бы только могла видеть, как это здорово!",excitement,book,pismovnik
"И еще все время пытаюсь найти какое-то оправдание тому, что ты сейчас не здесь, не рядом со мной. Не объяснение, а оправдание. Ведь зачем-то это надо, если это так есть. И вот что я подумала. Это как в детстве – если у тебя что-то есть, то этим надо делиться. Вот тебе дали конфеты, а у других нет. И нужно делиться. А то ведь могут и просто все отнять. И вот нужно в этой жизни делиться самым дорогим. И чем дороже, тем больше нужно отдать. Делиться самым любимым – а то совсем отнимут.",neutral,book,pismovnik
"Однажды его в учебке посадили под арест, он говорил – на губу. Вот за что. Он должен был зимой стоять на посту с боевым оружием и охранять самолеты. Ходил вокруг ангара, и ему показалось, что кто-то мелькнул в темноте. А кругом никого, тьма, и оттепель, все кругом капает, дышит. Он положил палец на спусковой крючок, осторожно выглянул из-за угла и тут же получил тяжелый удар по голове. Спусковой крючок сам и нажался. Выстрел, грохот. Все кругом переполошились, разбуженное начальство прибежало – а оказалось, это мокрый снег на крыше ангара подтаял, и в тот самый момент, когда папа выставил голову, снежная глыба сорвалась.",fear,book,pismovnik
"Летом он дал задание собирать гербарии – как я старался! Но больше, чем рвать растения по оврагам и засушивать их в томах Брокгауза, мне нравилось потом подписывать аккуратным почерком: «Одуванчик, Taraxacum» или «Подорожник, Plan-tago». Казалось удивительным, что обыкновенный подорожник может быть таким важным и красивым словом – «плантаго». Похоже, слова меня завораживали больше, чем сами высушенные скучные листочки.",distress,book,pismovnik
