text,emotion,source_type,source_name
"Обстрел идет из предместий и из артиллерийской школы, расположенной за высоким валом на берегу Пейхо напротив германской концессии. Там, говорят, обучались около трехсот молодых китайских офицеров, немцы поставили им новейшие орудия. Инструкторы-европейцы бежали, а один, который пытался повредить прицелы, был растерзан, и голова его до сих пор выставлена на бамбуковом шесте. По крайней мере, так рассказывают, а голову можно еще вчера было видеть в хорошую погоду в бинокль. Сегодня немцы и англичане взяли школу приступом. Большие потери и у наших союзников, и у китайцев.",neutral,book,pismovnik
"Уверен, он бы тебе понравился. Хотя Глазенап и имеет некоторые привычки, которые мне неприятны, как, например, сильно размахивать руками при разговоре, хватать собеседника за рукав, – он все же близок мне и симпатичен. Мне нравится его рассудительный голос, его умные глаза, уменьшенные линзами очков. Спать он может, только положив под голову свою китайскую узорную подушечку, набитую каким-то особым чаем, со специальной дырочкой для уха. А аромат этого чая, как он утверждает, очень полезен для глаз.",enjoyment,book,pismovnik
"А начал бы с того, что признался в одной вещи, которая мучит меня все эти годы и в которой я никак не мог ей признаться тогда. Понимаешь, Сашенька, это очень глупая история. Я играл с монетами на подоконнике. Помнишь наш широченный подоконник? Или это он мне тогда таким казался? Так вот, я играл монетами – ставил на ребро и щелкал пальцем по краю так, что она крутилась, превращалась в звонкий прозрачный шарик. А потом взгляд упал на широкую хрустальную вазочку, в которой лежали мамины украшения – брошки, браслеты, серьги, и там я увидел ее кольцо. Обручальное кольцо, которое ей подарил слепой. И так вдруг захотелось запустить его кружиться по подоконнику, как монетку!",distress,book,pismovnik
"Здесь люди грубеют, но они и становятся мягче. В них открывается что-то, что пряталось. Заметил, что даже те солдаты, которых я видел грубыми животными, тоже начинают писать домой нежные письма. Там он, наверно, напивался и бил жену, а теперь пишет ей: остаюсь с поцелуями и объятиями, твой любящий Петя. Разве ради одного этого не стоило его сюда послать?",neutral,book,pismovnik
"Зачем пишут? Пока пишут, значит, еще живы. Раз ты прочитала эти строчки – смерть отодвинулась. Чем я не Шахразада с ее историями? Только она богачка по сравнению со мной. Тысяча ночей, подумать только – это же целая вечность! А сколько же мне еще ночей отпущено? И где-то ведь есть эта цифра, существует, дожидается меня, как неоткрытая Америка.",fear,book,pismovnik
"Но настоящую проверку моя любовь к природе прошла через пару лет, тоже на даче и тоже с птенцом. Ко мне с ревом прибежал соседский мальчик, давился слезами и все никак не мог мне объяснить, что произошло. Я побежал за ним. То, что я увидел у них на дорожке, ведущей к крыльцу, действительно было не для детского глаза. Из гнезда упал птенец, но неудачно, рядом с муравейником, и он весь был облеплен муравьями, корчился беззвучно, и я растерялся, не зная, что делать. Спасти его было уже невозможно, но и просто стоять и смотреть на его мучения я тоже не мог.",fear,book,pismovnik
"Несколько раз мы видели на пляже очень странную пару. Молодые, красивые, влюбленные. У нее не было ноги по колено. Я запомнила, как она загорала, раздвинув ноги – без десяти два. На них смотрел весь пляж, когда он брал ее на руки и нес в море. Там они брызгались, визжали, уплывали далеко, до самых буйков. Когда они возвращались и вылезали из воды, она смеялась, вырывалась из его рук, скакала на одной ноге к своему полотенцу. Люди замирали, глядя на них, то ли ужасаясь, то ли завидуя.",startle,book,pismovnik
"«Захотелось купить цветы моей зайчихе, везде продают тюльпаны – при жизни ей букеты не дарил. А потом подумал, что все равно украдут с могилы. Камень глупый дочка заказала. А умных, наверно, на могилах и не бывает. Присел, помянул. Хорошо было, тихо, грустно. Снег уже почти сошел. Прошлогодней листвой пахнет. Надо бы поставить ограду, но нынче это ужасно дорого стоит. Приехал туда поздно и возвращался последним, за мной ворота закрыли. Шел вдоль ограды и смотрю – какие-то старики и старухи перелезают через забор. Забавно – беглецы с кладбища».",neutral,book,pismovnik
"И вдруг понимаю очень простую вещь, что вот этот полустанок, этот фонарь, удары молотка по буксе, стрекотание кузнечиков из окна телеграфной, запах дыма и горячего паровоза, дышащего паром и смазкой, и вот этот его паровозий вскрик, сиплый, усталый, – это я. И никакого меня другого нигде больше нет и не будет. И все уверения про вечное возвращение – все это сказки. Все только однократно и сейчас. И если мы сейчас тронемся – полустанок скроется, и я исчезну.",distress,book,pismovnik
"Но угадать было совершенно невозможно. То это был веер, то пиала, или лорнет, чайница, пустой флакон, сломанный фотоаппарат. Один раз принес маску японского театра но. Даже притащил откуда-то настоящую слоновью ногу, пустую внутри, для зонтов и тросточек. Мама ругалась на него, а я от его подарков чувствовала себя совершенно счастливой.",enjoyment,book,pismovnik
"Вообще она мало рассказывала. Одну семейную историю я узнал от нее, когда подрос. Ее бабка родила ребенка совсем еще юной девицей. Уверяла, что зачала непорочно, но никто ей не верил. О партеногенезе тогда и не слыхали. Как раз начался ледоход. Она пришла ночью на реку и положила свой кулек на льдину.",neutral,book,pismovnik
"Однажды была очень душная ночь, и я лежал под открытым окном и не мог заснуть. Было очень тихо, и с улицы долетал каждый шорох. У них в комнате тоже окно было открыто, и до меня доносилось, как они переговаривались в уверенности, что через две закрытые двери я ничего не слышу. Он мурлыкал, что у нее груди густые, а соски как наперстки. И еще что у нее под мышками тропики. И ей все это нравилось, она хихикала.",enjoyment,book,pismovnik
"Подумал, что секрет дежавю, наверно, заключается в том, что в книге бытия все это написано, конечно, только один раз. Но оживает опять, когда кто-то снова читает ту страницу, которая уже была когда-то прочитана. И тогда снова оказываются живы и эти обои, и прутик по штакетнику, и пахнущая вблизи рыба, повешенная на шпингалете, и шуршание этой щетины, и чайник с холодной заваркой, и женщины еще таинственны.",excitement,book,pismovnik
"Мы зашли с Убри в Гордон-Холл, муниципалитет английской концессии. Он рассказал, что здесь, в подвалах, во время осады укрывались женщины с детьми, а еду им готовили в соседней гостинице «Астор-Хаус». Там же, в подвалах Гордон-Холла, провел осаду и русский консул Шуйский с семьей. У него во время обстрела погиб семилетний сын.",distress,book,pismovnik
"Я хочу все время забраться подальше от берега, на глубину – папа не пускает, я принимаюсь его топить, хватаю за плечи, тяну за уши, за волосы – он отбивается, хватается за скользкий столб, выныривает, фыркает, капли блестят на ресницах, он хохочет. Вылезаем на деревянные мостки, идем по настилу, стараясь не занозить ноги о доски, шершавые, изъеденные солью. Бежим к маме, оба трясемся, кутаемся в полотенца, стучим зубами.",enjoyment,book,pismovnik
"Перед тем как пойти к ней, я спустилась во двор, чтобы собраться с силами. Захотелось глотнуть свежего, небольничного воздуха. На улице шел легкий снежок, и дворник лопатой сгребал его в сугробы. Пробежала кошка, и мне на минуту показалось, что это моя Кнопка, позвала ее, но это была Кнопка в новой шкурке.",excitement,book,pismovnik
"Еще у отчима было весьма своеобразное чувство юмора. Например, ест яблоко с ножом, очищает кожицу, держит отрезанную дольку на кончике ножа и рассказывает, смеясь, как на улице немолодая женщина довела его до почтамта, а на прощание жалостливым голосом сказала: «Чем так, лучше уж совсем не жить!» Отчим не удержался и ударил ее тростью. Он так рассказывал, будто хотел, чтобы все над этой историей весело посмеялись.",anger,book,pismovnik
"В городе идет неудержный и ненасытный грабеж. Грабят все. Комендантом назначили английского капитана Байли. Чтобы остановить мародерство, он тут же публично расстрелял одного из английских солдат – сипая. Наше начальство решило не упасть в грязь лицом и велело расстрелять двух русских. Схватили первых, кто под руку попался, и расстреляли. Узнав об этом, генерал Фукусима приказал расстрелять троих японцев.",fear,book,pismovnik
"Там на протяжении двух верст видны одни обгоревшие стены, одинокие трубы, груды камней, обломков и угля. Дома китайцев, уцелевшие от огня, разграблены. Во дворах разбросаны кучи простого и дорогого шелкового платья, всякая мебель, посуда, рухлядь, богатые китайские вышивки, фарфоровые вазы, картины с великолепной инкрустацией, часы – все разбито, затоптано.",fear,book,pismovnik
"От сегодняшней песчаной бури остался налет песка на всем. Даже на зубах скрипит. Все время хочется прополоскать рот. Но главное – жажда. Постоянно прикладываюсь к фляжке, правда, от этой воды только хуже. Пот ручьями льется по лицу и всему телу. А пыль, прилипшая к коже, покрывает ее густой липкой пленкой. Ну, вот, нажаловался. Все это ерунда, поверь!",fear,book,pismovnik
"Сашенька, ты знаешь, я слушал заупокойное бормотание, смотрел на солдат, стреляющих над могилой залпом в небо, а в голову лезли совершенно неподобающие минуте мысли. Вот американские индейцы стреляли в небо из луков, чтобы отогнать прочь злых духов, а у нас стрельбу из ружей на военных похоронах называют прощальным салютом. И это тот же самый обряд, какой отправляли индейцы, когда пускали в небо стрелы. И тем, кто сейчас в мешках лежит под глиной, ничего этого не нужно.",fear,book,pismovnik
"А сегодня проснулась и лежала, не открывая глаз, только слушала все звуки кругом, такие живые, такие простые, такие домашние – вот где-то строчит с утра пораньше швейная машинка, гудит лифт, хлопает дверь подъезда, трамвай дребезжит в конце улицы, какая-то птица верещит в форточку. Ты бы взглянул на нее и сказал, как она называется.",excitement,book,pismovnik
"«Читал о реинкарнации, потом решил побриться. Смотрю на свою седую щетину и понимаю, что переселение душ происходит постоянно, просто мы переселяемся сами в себя. Был мальчик, стал старик, и душа переселялась из тела в тело бесчисленное количество раз – каждое утро. Тело незаметно за ночь становится другим».",neutral,book,pismovnik
"«Юношей я думал о том, как когда-нибудь состарюсь и буду писать мемуары, и поэтому записывал в дневник что-то, что может потом понадобиться. И вот теперь, по другую сторону жизни, через много лет вспоминаю, как юношей писал дневник, который должен мне теперь помочь вспомнить важные события и переживания из моей жизни. Но теперь выходит: то, что казалось тогда важным, – ерунда. А что было на самом деле важным – на то не обращал внимания. Получается, что мне сейчас писать о том себе – вранье».",distress,book,pismovnik
"А когда Игорек родился, Костик так был восхищен появлением младенца в доме, что даже не ревновал. Однажды он попросил меня завернуть его в одеяло и поносить, как новорожденного. Я завернула и стала ходить с ним по комнате. Он засунул большой палец в рот и закрыл глаза. Потом расхохотался и стал брыкаться:",enjoyment,book,pismovnik
"Во сне я снова оказался на призывном пункте перед военной комиссией голым – довольно унизительная церемония. Все было как наяву, и я даже совсем не удивился, что прохожу это освидетельствование повторно. Стою в очереди, прикрывшись ладонями, смотрю поневоле на шрамы и ссадины стоящих передо мной, на их волосатые и голые ягодицы, на прыщи, бородавки. Все это унизительно, особенно когда доктор щупает каждого в паху, потом нужно еще повернуться, наклониться вперед и раздвинуть промежность. И вот очередь доходит до меня, а врачом почему-то оказывается Виктор Сергеевич, мой учитель, который умер на уроке. Он протирает галстуком очки и смотрит на меня. Я начинаю оправдываться, что искал те таблетки, о которых он нам говорил, но так нервничал, что никак не мог найти:",shame,book,pismovnik
"На уроке он показывал нам в микроскоп простейших. Забрасывал галстук за спину, чтобы не мешал, а тот все время падал. Ничего толком не было видно, какие-то кляксы, а учитель вдохновенно убеждал нас, что мы видим реальное бессмертие. А чтобы до нас дошло, он почему-то привел в пример меня, что доставило классу море восторга, а мне было до слез обидно, отчего он не понимает, что издевается надо мной. Он стал смешить моих однокашников представлением того, как я делюсь пополам, при этом обе мои половинки остаются мною, каждая представляет собой молодую особь, оставаясь одновременно старой, и начинается жизнь сначала – и так длится миллионы лет.",excitement,book,pismovnik
"Я рад, что у нас в отряде появился этот молодой человек, восторженно влюбленый в язык Конфуция, Ли Бо и Ду Фу. Он чем-то напоминает жюльверновского Паганеля. Таким, наверно, и был Паганель в юности – неуверенным в себе, неуклюжим, но задиристым всезнайкой. Сегодня он научил нас пить воду из Пейхо, солоноватую, илистую, смешивая ее с ханьшином, китайской водкой.",excitement,book,pismovnik
"Увы, затишье для нас, а не для смерти. Приходится хоронить по-прежнему, почти каждый день, но теперь крестов не ставим и стараемся сделать так, чтобы могила была незаметна. Ту первую братскую могилу, о которой я тебе писал, ночью китайцы разрыли и тела разбросали, изуродовав их. Так они нас ненавидят. А заметили это наутро, потому что часовой из сторожевого охранения увидел собаку с отгрызенной человеческой кистью в зубах.",distress,book,pismovnik
"Я жив и здоров, хотя сильно похудел и на мне все висит, как на коле. В последние дни что-то опять не так с желудком. Ходил к врачу, но Заремба только посоветовал мне ничего пока не есть. Вшей еще не развел. Умываюсь, как и большинство, редко, бреюсь тоже редко, весь зарос. Решил сегодня побриться, привести себя в порядок. Сидел на ящике из-под снарядов и сбривал мою пятидневную щетину. Помазком послужил лоскут бинта. Мне не хватает маленького зеркала для бритья. Свое я разбил, пришлось одолжить у Кирилла. Хотя здесь редко бреешься, но время от времени это надо делать, не то совсем одичаешь.",distress,book,pismovnik
"Помню, как папа, когда я была совсем маленькая и ужасно любила вертеться на винтовом табурете, играл со мной на фортепьяно: кластеры в басах на педальных поддержках изображали тучи. Высокие отрывистые звуки, схваченные педалью, таяли редкими снежинками в воздухе. А летний дождик получался так: только указательные пальцы – одна рука по черным, другая по белым клавишам – быстро-быстро перескакивали со звука на звук. У него была широкая рука – брала полторы октавы.",neutral,book,pismovnik
