text,emotion,source_type,source_name
"Через четыре месяца мы достигли равнинного острова величиной в одну милю и спустились с корабля, чтобы приготовить себе пищу. Как только был разожжен огонь, остров сам ушел под воду, мы же побежали как можно быстрее обратно на корабль, оставив там наши припасы с горшками. Нам сказали, что это не остров, а рыба под названием Ясконтий, которая, почувствовав огонь, вместе с нашими припасами ушла под воду.",neutral,book,pismovnik
"Теперь на этот европейский город в центре Азии страшно смотреть. Ни одно здание, ни одну виллу не пощадил огонь или снаряд. Причем разрушали не только китайцы. Убри показал мне в крайней, французской концессии полностью уничтоженный огромный квартал, непосредственно примыкавший к госпиталю и заселенный китайцами-христианами, – французский консул приказал сжечь его дотла, потому что боялся поджога и нападения со стороны китайского города.",startle,book,pismovnik
"Про страшилку я ей больше верила, чем отцу, хотя она меня постоянно ругала, твердила, что у меня нет вкуса, что не так одеваюсь, не так разговариваю, не так смеюсь. Я с ней всегда чувствовала себя виноватой. Мне и в голову не могло прийти, что она слишком строга или несправедлива ко мне. Он видел во мне достоинства, а она – недостатки.",fear,book,pismovnik
"Вспомнила притчу про мудреца, который говорил своим спутникам делать что-то странное, необъяснимое. А потом их глупым действиям находился какой-то глубокий, не видимый им, но внятный мудрецу смысл. Сначала он приказал продырявить лодку бедных рыбаков, и она утонула, потом велел убить встречного прохожего и напоследок, не взяв никакой платы, восстановил разрушенную стену в селении, жители которого отказали ему в крове и пище. А потом он объяснил смысл этих поступков. Лодку затопили, чтобы ее не захватил гнавшийся за ними и отбиравший все суда царь-тиран, прохожий шел убить своего сына, а стена принадлежала сиротам, и там был клад, который они потом найдут.",excitement,book,pismovnik
"Мы стали на якорь в заливе уже к вечеру и разгружались до поздней ночи. Когда стемнело, на всех кораблях зажглись огни, целые созвездия электричества на мачтах, реях. Ты знаешь, это было очень красиво! Впервые пожалел, что тебя не было со мной. Отблески иллюминаторов в черной воде, огоньки катеров, шлюпок. То и дело вспыхивали лучи прожекторов, утыкались в облака и оставляли в них лунные пятна. Смотрел на эту иллюминацию и думал о тебе. С берега шел теплый ветерок и приносил какие-то новые неузнаваемые запахи. Было и радостно отчего-то, и страшновато. Лучи то вспыхивали, то гасли. Представляешь, так корабли переговариваются, посылая друг другу сигналы через облака.",neutral,book,pismovnik
"По воскресеньям мама строго запрещала мне будить их рано и выходила из спальни довольная, напевая что-то, с красными пятнами на шее – раздражение от его щетины. Она у него так быстро отрастала, что отчим брился иногда два раза в день, если вечером они еще куда-нибудь шли. Свет ему был не нужен, и он часто сидел в темноте, и даже брился в темноте – на ощупь и на слух – где еще шаркала бритва.",neutral,book,pismovnik
"Во время моей игры он садился на корточки, чтобы посмотреть, не провисает ли у меня ладонь, от фальшивой ноты дергался и стонал, будто прикусил язык, а один раз, когда я вместо указанных пальцев четвертого и пятого, думая, что он не заметит, играла трель вторым и третьим, он так вышел из себя, что чуть не прибил меня растрепанным Черни.",distress,book,pismovnik
"Много инбирю и шелка на этом краю света. Сколько тут дичи, так просто удивительно. За один венецианский грош можно купить трех фазанов. Народ тут злой; воровать и разбойничать за грех не почитается, таких насмешников и разбойников в свете нет. Живут тут идолопоклонники, и деньги у них бумажные, мертвых своих сжигают, всяких харчей у них вдоволь, но едят они фараоновых крыс.",distress,book,pismovnik
"Ночами было невозможно заснуть, глядя на то, как она мучается и как призывно воет. И постель такая льдистая. Лежу с открытыми глазами, все в луне, и думаю, что моя кошка – часть какого-то гигантского механизма, в котором участвуют и луна, и весна, приливы и отливы, дни и ночи, и зимняя слониха, и вообще все когда-либо рожденные и еще нерожденные кошки и некошки. И я вместе с ней начинала ощущать себя тоже частью этого механизма, этого непонятно каким образом заведенного порядка, требующего прикосновений. Хотелось вдруг тоже взять и завыть. За миллионы лет сколько таких было, как мы с Кнопкой, подлунных, покрытых и непокрытых шерстью и чешуей, которые так же мучились по ночам и могли думать только об одном – чтобы кто-то приласкал.",neutral,book,pismovnik
"Походила по коридорам, везде неуютно, дует из окон, отовсюду запах краски, вонь из уборных. Нашла по расписанию комнату. Заглянула. Они там рисуют натуру. Проскользнула, села. Никто на меня даже не посмотрел, все заняты, сосредоточены. Стараются. На помосте стоит женщина, голая, а кругом столько молодых мужчин и не видят. Вернее, видят что-то не то.",disgust,book,pismovnik
"– И вообще, какое глупое слово – «измена». Ты же ничего ни у кого не отнимаешь. Это просто другое, тоже необходимое. И ничье место это другое не занимает. Этого другого в жизни не было, оно заполняет собой пустоту, которая оставалась бы незаполненной. Без этого ходишь, будто из мира изъяли здоровый кусок и из тебя. Это помогает почувствовать себя цельной, настоящей, живой. Я была с другими счастлива как женщина, понимаешь? И они говорили мне такие вещи, которые твой отец никогда не говорил.",distress,book,pismovnik
"Смотрю в лунку, а в ней луностояние. Зимний дым над фабрикой башковит. Долго проплывают газгольдеры, увенчанные сигнальными огнями, потом остановка у школы – там уже начался за заиндевелыми окнами первый урок, и еще заспанных, зевающих учат, что нельзя долго смотреть на луну, а то лунатиком станешь, что мальчики – это будущие солдаты, а девочки – санитарки, и что я у гусеницы и я у бабочки – совсем разные, но это одно и то же.",distress,book,pismovnik
"Смотрю на нее иногда и узнаю себя в детстве. Ведь я точно так же когда-то грызла яблоко и ходила туда-сюда по полоске света на паркете от щели между шторами. Точно так же любила тюрю, которую мне делала мама: теперь я режу хлеб кубиками и бросаю в миску с теплым молоком, потом посыпаю сахарным песком из чайной ложки. Еще мама меня научила стелить постель – я показала один раз зайке, как можно сделать так, чтобы у подушки из-под одеяла торчали ушки, и теперь постель всегда застелена.",enjoyment,book,pismovnik
"– Вот и я, сынок, был в твоем возрасте – и вдруг все понял. А потом всю жизнь пытался понять, что я тогда понял. Ты сальца возьми, знатное сальце! И запомни: любое слово умнее пера. А про похоронки – не переживай. Вон предыдущий писарь до тебя все переживал. Как сильно выпьет, навалится мне на плечо и плачет, как мальчишка: «Коль, прости меня, что не погиб, ведь я за всю войну ни разу не был на передовой…» Просил прощения у меня, а сам как будто говорил со всеми теми, на кого довелось ему писать извещения.",distress,book,pismovnik
"Часто вспоминала, как однажды, когда стало невмоготу, закрыла глаза и вдруг почувствовала, что счастлива. Счастье, наверно, и должно быть таким, мгновенным, как укол иголкой: ребенок канючит, от клеенки несет мочой, денег нет, погода отвратительная, молоко сбежало, нужно теперь отдраивать плиту, по радио передают землетрясение, где-то война, а все вместе это и есть счастье.",enjoyment,book,pismovnik
"Я сошелся с переводчиком, прикомандированным к нам. Это студент Восточного факультета Петербургского университета по фамилии Глазенап. Его походный мешок набит книгами, свитками, воззваниями, которые он повсюду подбирает и подносит к самому носу, чтобы прочитать. У него плохое зрение и очки с претолстыми стеклами.",neutral,book,pismovnik
"– Ты просто еще не знаешь, как это бывает. Забудешь в кафе зонтик, вернешься – и жизнь примет другой оборот. Помнишь, ты пошла в тот ваш парк. Снег падал сухой, мелкой крупой, с подскоком. Тебе показалось, что в парке, кроме тебя, никого нет, будто он был твой собственный. Подошла к скамейке, смахнула снег перчаткой, присела. А напротив как раз стояла та скульптура, забитая досками. Под завывания метели зимними ночами есть время подумать, что сделала не так. Стоит в своем гробу – одна рука сюда, другая туда – и меняется. Становится еще больше сама собой. И знает, что скоро выходить. Откроют крышку, а она там как ни в чем не бывало – одна рука здесь, другая там – вот я! Дождались? Как вы тут без меня? Что у вас тут новенького? Трою взяли? Та же, но другая – что-то поняла за зиму. И тут к тебе подбежала собака. Спаниель понюхал тебя. Дался почесать за ухом, замотал хвостом. А ты понюхала его – дохнуло вкусной собачиной. Потом появилась девочка с поводком и сразу сообщила тебе, что она теперь занимается балетом и знает уже все позиции, и что Доньке нельзя давать сладости, а то ее может пронести. У девочки уши со сросшейся мочкой. И легкое косоглазие. Потом появился Янкин профессор, которого ты сразу узнала, а он тебя нет. У него уши большие, мясистые, с кисточками волос, и мочки свисают до воротника. Ты сперва решила, что девочка – его ранняя внучка, но он назвал ее, как твой отец называл тебя, – доча. У него в руках была детская клизма. Он швырял ее, и собака носилась за ней с лаем между деревьями. Потом он присел рядом на скамейку, сцепив руки на колене, и пальцы у него были крепкие, ободранные, изъедены растворителем, а на ногтях остатки краски. Девочка бегала за собакой, а он говорил, что давно уже ничего не читает, потому что нужно писать живой жизнью – слезами, кровью, потом, мочой, калом, спермой, а они пишут чернилами. Ты в тот момент еще подумала: скольким же дурочкам он говорил это за свою долгую жизнь.",distress,book,pismovnik
"Больше всего раздражали мелочи. Нельзя было бросать вещи просто так – у каждого предмета теперь появилось свое обязательное место. Нельзя было оставлять дверь полуоткрытой – нужно было или закрыть ее совсем или открыть. Когда он ложился отдохнуть, все в доме должно было замереть. В уборной он положил коробок, и каждый раз после себя сжигал спичку и требовал от всех того же.",disgust,book,pismovnik
"Папа обнимает ее одной рукой, а другой отводит папиросу подальше в сторону и выпускает дым струйкой вбок углом рта. Мама в мокрой шубе прижимается к папе и проводит пригоршней снега ему по распаленной коже на шее, а рука, голая до локтя, от снежного заоконного света белая-белая, будто в длинной бальной перчатке.",enjoyment,book,pismovnik
"Ну вот, например, вчера договорились, что я зайду за Янкой, но пришла раньше, у них занятия еще не кончились, и я решила подождать внутри, чтобы не торчать на улице, лето какое-то нелетнее, холод, ветер. Там ремонт, у подъезда в люльку как раз залезали маляры – один, с огромной незрелой клубникой вместо носа, подмигнул мне, сделал в шутку вид, что сейчас обольет краской из ведра. Я рассмеялась. Как мало действительно нужно, чтобы почувствовать себя вдруг счастливой, – если все это можно потом тебе рассказать. Иначе, понимаешь, всего этого и нет. Ни маляра с его клубникой, ни побитого ведра с охрой.",enjoyment,book,pismovnik
"Так вот, этот Рыбаков в самую первую ночь беспорядков стоял со своими солдатами в заставе, охранявшей французскую концессию. Они услышали из китайского города шум, крики, там поднялось зарево – это полыхал католический собор. К их заставе стали подбегать перепуганные люди. Ихэтуани поджигали дома китайцев-христиан, сотни людей погибли. Самому настоятелю собора удалось бежать во французскую концессию. В ту же ночь был первый штурм cеттльмента, но удалось отбиться.",fear,book,pismovnik
"Я рад, что у нас в отряде появился этот молодой человек, восторженно влюбленый в язык Конфуция, Ли Бо и Ду Фу. Он чем-то напоминает жюльверновского Паганеля. Таким, наверно, и был Паганель в юности – неуверенным в себе, неуклюжим, но задиристым всезнайкой. Сегодня он научил нас пить воду из Пейхо, солоноватую, илистую, смешивая ее с ханьшином, китайской водкой.",excitement,book,pismovnik
"Увы, затишье для нас, а не для смерти. Приходится хоронить по-прежнему, почти каждый день, но теперь крестов не ставим и стараемся сделать так, чтобы могила была незаметна. Ту первую братскую могилу, о которой я тебе писал, ночью китайцы разрыли и тела разбросали, изуродовав их. Так они нас ненавидят. А заметили это наутро, потому что часовой из сторожевого охранения увидел собаку с отгрызенной человеческой кистью в зубах.",fear,book,pismovnik
"Я жив и здоров, хотя сильно похудел и на мне все висит, как на коле. В последние дни что-то опять не так с желудком. Ходил к врачу, но Заремба только посоветовал мне ничего пока не есть. Вшей еще не развел. Умываюсь, как и большинство, редко, бреюсь тоже редко, весь зарос. Решил сегодня побриться, привести себя в порядок. Сидел на ящике из-под снарядов и сбривал мою пятидневную щетину. Помазком послужил лоскут бинта. Мне не хватает маленького зеркала для бритья. Свое я разбил, пришлось одолжить у Кирилла. Хотя здесь редко бреешься, но время от времени это надо делать, не то совсем одичаешь.",distress,book,pismovnik
"Помню, как папа, когда я была совсем маленькая и ужасно любила вертеться на винтовом табурете, играл со мной на фортепьяно: кластеры в басах на педальных поддержках изображали тучи. Высокие отрывистые звуки, схваченные педалью, таяли редкими снежинками в воздухе. А летний дождик получался так: только указательные пальцы – одна рука по черным, другая по белым клавишам – быстро-быстро перескакивали со звука на звук. У него была широкая рука – брала полторы октавы.",enjoyment,book,pismovnik
